question_text,company,difficulty,question_type,topics,source,answer_text,created_at
"Collective anomalies: A set of data instances collectively helps in detecting anomalies. Business use case: Someone is trying to copy data form a remote machine to a local host unexpectedly, an anomaly that would be flagged as a potential cyber attack. Best steps to prevent anomalies is to implement policies or checks that can catch them during the data collection stage. Unfortunately, you do not often get to collect your own data, and often the data you're mining was collected for another purpose. About 68% of all the data points are within one standard deviation from the mean. About 95% of the data points are within two standard deviations from the mean. Finally, over 99% of the data is within three standard deviations from the mean. When the value deviate too much from the mean, let’s say by ± 4σ, then we can considerate this almost impossible value as anomaly. (This limit can also be calculated using the percentile). #### Statistical methods Statistically based anomaly detection uses this knowledge to discover outliers. A dataset can be standardized by taking the z-score of each point. A z-score is a measure of how many standard deviations a data point is away from the mean of the data. Any data-point that has a z-score higher than 3 is an outlier, and likely to be an anomaly. As the z-score increases above 3, points become more obviously anomalous. A z-score is calculated using the following equation. A box-plot is perfect for this application. #### Metric method Judging by the number of publications, metric methods are the most popular methods among researchers. They postulate the existence of a certain metric in the space of objects, which helps to find anomalies. Intuitively, the anomaly has few neighbors in the instannce space, and a typical point has many. Therefore, a good measure of anomalies can be, for example, the «distance to the k-th neighbor». (See method: Local Outlier Factor). Specific metrics are used here, for example Mahalonobis distance. Mahalonobis distance is a measure of distance between vectors of random variables, generalizing the concept of Euclidean distance. Using Mahalonobis distance, it is possible to determine the similarity of unknown and known samples. It differs from Euclidean distance in that it takes into account correlations between variables and is scale invariant. !alt text The most common form of clustering-based anomaly detection is done with prototype-based clustering. Using this approach to anomaly detection, a point is classified as an anomaly if its omission from the group significantly improves the prototype, then the point is classified as an anomaly. This logically makes sense. K-means is a clustering algorithm that clusters similar points. The points in any cluster are similar to the centroid of that cluster, hence why they are members of that cluster. If one point in the cluster is so far from the centroid that it pulls the centroid away from it's natural center, than that point is literally an outlier, since it lies outside the natural bounds for the cluster. Hence, its omission is a logical step to improve the accuracy of the rest of the cluster. Using this approach, the outlier score is defined as the degree to which a point doesn't belong to any cluster, or the distance it is from the centroid of the cluster. In K-means, the degree to which the removal of a point would increase the accuracy of the centroid is the difference in the SSE, or standard squared error, or the cluster with and without the point. If there is a substantial improvement in SSE after the removal of the point, that correlates to a high outlier score for that point. More specifically, when using a k-means clustering approach towards anomaly detection, the outlier score is calculated in one of two ways. The simplest is the point's distance from its closest centroid. However, this approach is not as useful when there are clusters of differing densities. To tackle that problem, the point's relative distance to it's closest centroid is used, where relative distance is defined as the ratio of the point's distance from the centroid to the median distance of all points in the cluster from the centroid. This approach to anomaly detection is sensitive to the value of k. Also, if the data is highly noisy, then that will throw off the accuracy of the initial clusters, which will decrease the accuracy of this type of anomaly detection. The time complexity of this approach is obviously dependent on the choice of clustering algorithm, but since most clustering algorithms have linear or close to linear time and space complexity, this type of anomaly detection can be highly efficient. ## 17. How do you deal with outliers in your data? For the most part, if your data is affected by these extreme cases, you can bound the input to a historical representative of your data that excludes outliers. So that could be a number of items (>3) or a lower or upper bounds on your order value. If the outliers are from a data set that is relatively unique then analyze them for your specific situation. Analyze both with and without them, and perhaps with a replacement alternative, if you have a reason for one, and report your results of this assessment. One option is to try a transformation. Square root and log transformations both pull in high numbers. This can make assumptions work better if the outlier is a dependent. ## 18. How do you deal with sparse data? We could take a look at L1 regularization since it best fits to the sparse data and do feature selection. If linear relationship - linear regression either - svm. Also it would be nice to use one-hot-encoding or bag-of-words. A one hot encoding is a representation of categorical variables as binary vectors. This first requires that the categorical values be mapped to integer values. Then, each integer value is represented as a binary vector that is all zero values except the index of the integer, which is marked with a 1. ## 19. Big Data Engineer Can you explain what REST is? REST stands for Representational State Transfer. (It is sometimes spelled ""ReST"".) It relies on a stateless, client-server, cacheable communications protocol -- and in virtually all cases, the HTTP protocol is used. REST is an architecture style for designing networked applications. The idea is simple HTTP is used to make calls between machines. * In many ways, the World Wide Web itself, based on HTTP, can be viewed as a REST-based architecture. RESTful applications use HTTP requests to post data (create and/or update), read data (e.g., make queries), and delete data. Thus, REST uses HTTP for all four CRUD (Create/Read/Update/Delete) operations. REST is a lightweight alternative to mechanisms like RPC (Remote Procedure Calls) and Web Services (SOAP, WSDL, et al.). Later, we will see how much more simple REST is. * Despite being simple, REST is fully-featured; there's basically nothing you can do in Web Services that can't be done with a RESTful architecture. REST is not a ""standard"". There will never be a W3C recommendation for REST, for example. And while there are REST programming frameworks, working with REST is so simple that you can often ""roll your own"" with standard library features in languages like Perl, Java, or C#. ## 20. Logistic regression Log odds - raw output from the model; odds - exponent from the output of the model. Probability of the output - odds / (1+odds). ## 21. What is the effect on the coefficients of logistic regression if two predictors are highly correlated? What are the confidence intervals of the coefficients? When predictor variables are correlated, the estimated regression coefficient of any one variable depends on which other predictor variables are included in the model. When predictor variables are correlated, the precision of the estimated regression coefficients decreases as more predictor variables are added to the model. In statistics, multicollinearity (also collinearity) is a phenomenon in which two or more predictor variables in a multiple regression model are highly correlated, meaning that one can be linearly predicted from the others with a substantial degree of accuracy. In this situation the coefficient estimates of the multiple regression may change erratically in response to small changes in the model or the data. Multicollinearity does not reduce the predictive power or reliability of the model as a whole, at least within the sample data set; it only affects calculations regarding individual predictors. That is, a multiple regression model with correlated predictors can indicate how well the entire bundle of predictors predicts the outcome variable, but it may not give valid results about any individual predictor, or about which predictors are redundant with respect to others. The consequences of multicollinearity: * Ratings estimates remain unbiased. * Standard coefficient errors increase. * The calculated t-statistics are underestimated. * Estimates become very sensitive to changes in specifications and changes in individual observations. * The overall quality of the equation, as well as estimates of variables not related to multicollinearity, remain unaffected. * The closer multicollinearity to perfect (strict), the more serious its consequences. Indicators of multicollinearity:",,medium,coding,regression|clustering|probability|metrics|feature_engineering,iamtodor/data-science-interview-questions-and-answers,,2025-11-17T10:49:36.286401
High R2 and negligible odds.,,medium,mixed,,iamtodor/data-science-interview-questions-and-answers,,2025-11-17T10:49:36.286427
Strong pair correlation of predictors.,,medium,mixed,,iamtodor/data-science-interview-questions-and-answers,,2025-11-17T10:49:36.286450
"High VIF - variance inflation factor. Confidence interval (CI) is a type of interval estimate (of a population parameter) that is computed from the observed data. The confidence level is the frequency (i.e., the proportion) of possible confidence intervals that contain the true value of their corresponding parameter. In other words, if confidence intervals are constructed using a given confidence level in an infinite number of independent experiments, the proportion of those intervals that contain the true value of the parameter will match the confidence level. Confidence intervals consist of a range of values (interval) that act as good estimates of the unknown population parameter. However, the interval computed from a particular sample does not necessarily include the true value of the parameter. Since the observed data are random samples from the true population, the confidence interval obtained from the data is also random. If a corresponding hypothesis test is performed, the confidence level is the complement of the level of significance, i.e. a 95% confidence interval reflects a significance level of 0.05. If it is hypothesized that a true parameter value is 0 but the 95% confidence interval does not contain 0, then the estimate is significantly different from zero at the 5% significance level. The desired level of confidence is set by the researcher (not determined by data). Most commonly, the 95% confidence level is used. However, other confidence levels can be used, for example, 90% and 99%. Factors affecting the width of the confidence interval include the size of the sample, the confidence level, and the variability in the sample. A larger sample size normally will lead to a better estimate of the population parameter. A Confidence Interval is a range of values we are fairly sure our true value lies in. X ± Z*s/√(n), X is the mean, Z is the chosen Z-value from the table, s is the standard deviation, n is the number of samples. The value after the ± is called the margin of error. ## 22. What’s the difference between Gaussian Mixture Model and K-Means? Let's says we are aiming to break them into three clusters. K-means will start with the assumption that a given data point belongs to one cluster. Choose a data point. At a given point in the algorithm, we are certain that a point belongs to a red cluster. In the next iteration, we might revise that belief, and be certain that it belongs to the green cluster. However, remember, in each iteration, we are absolutely certain as to which cluster the point belongs to. This is the ""hard assignment"". What if we are uncertain? What if we think, well, I can't be sure, but there is 70% chance it belongs to the red cluster, but also 10% chance its in green, 20% chance it might be blue. That's a soft assignment. The Mixture of Gaussian model helps us to express this uncertainty. It starts with some prior belief about how certain we are about each point's cluster assignments. As it goes on, it revises those beliefs. But it incorporates the degree of uncertainty we have about our assignment. Kmeans: find kk to minimize (x−μk)^2 Gaussian Mixture (EM clustering) : find kk to minimize (x−μk)^2/σ^2 The difference (mathematically) is the denominator “σ^2”, which means GM takes variance into consideration when it calculates the measurement. Kmeans only calculates conventional Euclidean distance. In other words, Kmeans calculate distance, while GM calculates “weighted” distance. K means: * Hard assign a data point to one particular cluster on convergence. * It makes use of the L2 norm when optimizing (Min {Theta} L2 norm point and its centroid coordinates). EM: * Soft assigns a point to clusters (so it give a probability of any point belonging to any centroid). * It doesn't depend on the L2 norm, but is based on the Expectation, i.e., the probability of the point belonging to a particular cluster. This makes K-means biased towards spherical clusters. ## 23. Describe how Gradient Boosting works. The idea of boosting came out of the idea of whether a weak learner can be modified to become better. Gradient boosting relies on regression trees (even when solving a classification problem) which minimize MSE. Selecting a prediction for a leaf region is simple: to minimize MSE we should select an average target value over samples in the leaf. The tree is built greedily starting from the root: for each leaf a split is selected to minimize MSE for this step. To begin with, gradient boosting is an ensembling technique, which means that prediction is done by an ensemble of simpler estimators. While this theoretical framework makes it possible to create an ensemble of various estimators, in practice we almost always use GBDT — gradient boosting over decision trees. The aim of gradient boosting is to create (or ""train"") an ensemble of trees, given that we know how to train a single decision tree. This technique is called boosting because we expect an ensemble to work much better than a single estimator. Here comes the most interesting part. Gradient boosting builds an ensemble of trees one-by-one, then the predictions of the individual trees are summed: D(x)=d​tree 1​​(x)+d​tree 2​​(x)+... The next decision tree tries to cover the discrepancy between the target function f(x) and the current ensemble prediction by reconstructing the residual. For example, if an ensemble has 3 trees the prediction of that ensemble is: D(x)=d​tree 1​​(x)+d​tree 2​​(x)+d​tree 3​​(x). The next tree (tree 4) in the ensemble should complement well the existing trees and minimize the training error of the ensemble. In the ideal case we'd be happy to have: D(x)+d​tree 4​​(x)=f(x). To get a bit closer to the destination, we train a tree to reconstruct the difference between the target function and the current predictions of an ensemble, which is called the residual: R(x)=f(x)−D(x). Did you notice? If decision tree completely reconstructs R(x), the whole ensemble gives predictions without errors (after adding the newly-trained tree to the ensemble)! That said, in practice this never happens, so we instead continue the iterative process of ensemble building. ### AdaBoost the First Boosting Algorithm The weak learners in AdaBoost are decision trees with a single split, called decision stumps for their shortness. AdaBoost works by weighting the observations, putting more weight on difficult to classify instances and less on those already handled well. New weak learners are added sequentially that focus their training on the more difficult patterns. Gradient boosting involves three elements:",,hard,coding,regression|classification|clustering|hypothesis_testing|probability|ensemble|metrics,iamtodor/data-science-interview-questions-and-answers,,2025-11-17T10:49:36.287568
A loss function to be optimized.,,medium,mixed,,iamtodor/data-science-interview-questions-and-answers,,2025-11-17T10:49:36.287593
A weak learner to make predictions.,,medium,mixed,,iamtodor/data-science-interview-questions-and-answers,,2025-11-17T10:49:36.287616
