question_text,company,difficulty,question_type,topics,source,answer_text,created_at
"More Data: Generally reduces variance, but can also help a high-bias model better capture underlying patterns.",,medium,stats,,Devinterview-io/data-scientist-interview-questions,,2025-11-17T10:49:35.639618
Feature Selection/Engineering: Aims to reduce overfitting by focusing on the most relevant features.,,medium,coding,feature_engineering,Devinterview-io/data-scientist-interview-questions,,2025-11-17T10:49:35.639658
Simpler Models: Helps alleviate overfitting; reduces variance but might increase bias.,,medium,stats,,Devinterview-io/data-scientist-interview-questions,,2025-11-17T10:49:35.639684
"Regularization: A technique that adds a penalty term for model complexity, which can help decrease overfitting.",,medium,ml,,Devinterview-io/data-scientist-interview-questions,,2025-11-17T10:49:35.639712
"Ensemble Methods: Combine multiple models to reduce variance and, in some cases, improve bias.",,medium,stats,ensemble,Devinterview-io/data-scientist-interview-questions,,2025-11-17T10:49:35.639737
"Cross-Validation: Helps estimate the performance of a model on an independent dataset, providing insights into both bias and variance. <br> ## 6. Explain the concept of _Cross-Validation_ and its importance in ML. Cross-Validation (CV) is a robust technique for assessing the performance of a machine learning model, especially when it involves hyperparameter tuning or comparing multiple models. It addresses issues such as overfitting and ensures a more reliable performance estimate on unseen data. ### Kinds of Cross-Validation",,medium,stats,,Devinterview-io/data-scientist-interview-questions,,2025-11-17T10:49:35.639810
Holdout Method: Data is simply split into training and test sets.,,medium,ml,,Devinterview-io/data-scientist-interview-questions,,2025-11-17T10:49:35.639831
"K-Fold CV: Data is divided into K folds; each fold is used as a test set, and the rest are used for training.",,medium,ml,,Devinterview-io/data-scientist-interview-questions,,2025-11-17T10:49:35.639857
"Stratified K-Fold CV: Like K-Fold, but preserves the class distribution in each fold, useful for balanced datasets.",,medium,stats,probability,Devinterview-io/data-scientist-interview-questions,,2025-11-17T10:49:35.639882
Leave-One-Out (LOO) CV: A special case of K-Fold where K equals the number of instances; each observation is used as a test set once.,,medium,mixed,,Devinterview-io/data-scientist-interview-questions,,2025-11-17T10:49:35.639919
"Time Series CV: Specifically designed for temporal data, where the training set always precedes the test set. ### Benefits of K-Fold Cross-Validation - Data Utilization: Every data point is used for both training and testing, providing a more comprehensive model evaluation. - Performance Stability: Averaging results from multiple folds can help reduce variability. - Hyperparameter Tuning: Helps in tuning model parameters more effectively, especially when combined with techniques like grid search. ### Code Example: K-Fold Cross-Validation Here is the Python code: `python import numpy as np from sklearn.model_selection import KFold # Create sample data X = np.array([[1, 2], [3, 4], [5, 6], [7, 8], [9, 10]]) y = np.array([1, 2, 3, 4, 5]) # Initialize K-Fold splitter kf = KFold(n_splits=3) # Demonstrate how data is split fold_index = 1 for train_index, test_index in kf.split(X): print(f""Fold {fold_index} - Train set indices: {train_index}, Test set indices: {test_index}"") fold_index += 1 ` <br> ## 7. What is _Regularization_ and how does it help prevent _overfitting_? Regularization in machine learning is a technique used to prevent overfitting, which occurs when a model is too closely fit to a limited set of data points and may perform poorly on new data. Regularization discourages overly complex models by adding a penalty term to the loss function used to train the model. ### Types of Regularization #### L1 Regularization (Lasso Regression) $$ \text{Cost} + \lambda \sum_{i=1}^{n} |w_i| $$ L1 regularization, also known as Lasso (Least Absolute Shrinkage and Selection Operator), adds the absolute values of the coefficients to the cost function. This encourages a sparse solution, effectively performing feature selection by potentially reducing some coefficients to zero. #### L2 Regularization (Ridge Regression) $$ \text{Cost} + \lambda \sum_{i=1}^{n} w_i^2 $$ L2 regularization, or Ridge regression, adds the squared values of the coefficients to the cost function. This generally helps to reduce the model complexity by constraining the coefficients, especially effective when many features have small or moderate effects. #### Elastic Net Regularization $$ \text{Cost} + \lambda_1 \sum_{i=1}^{n} |w_i| + \lambda_2 \sum_{i=1}^{n} w_i^2 $$ Elastic Net is a hybrid of L1 and L2 regularization. It combines both penalties in the cost function and is useful for handling situations when there are correlations amongst the features or when you need to incorporate both attributes of L1 and L2 regularization. #### Max Norm Regularization Max Norm Regularization constrains the L2 norm of the weights for each neuron and is typically used in neural networks. It limits the size of the parameter weights, ensuring that they do not grow too large: `python from keras.constraints import max_norm ` This can be particularly beneficial in preventing overfitting in deep learning models. ### Code Examples #### L1 and L2 Regularization Example: For Lasso and Ridge regression, you can use the respective classes from Scikit-learn’s linear_model module: `python from sklearn.linear_model import Lasso, Ridge # Example of Lasso Regression lasso_reg = Lasso(alpha=0.1) lasso_reg.fit(X_train, y_train) # Example of Ridge Regression ridge_reg = Ridge(alpha=1.0) ridge_reg.fit(X_train, y_train) ` #### Elastic Net Regularization Example: You can apply Elastic Net regularization using its specific class from Scikit-learn: `python from sklearn.linear_model import ElasticNet # Elastic Net combines L1 and L2 regularization elastic_net = ElasticNet(alpha=1.0, l1_ratio=0.5) elastic_net.fit(X_train, y_train) ` #### Max Norm Regularization Example: Max Norm regularization can be specified for layers in a Keras model as follows: `python from keras.layers import Dense from keras.models import Sequential from keras.constraints import max_norm model = Sequential() model.add(Dense(64, input_dim=8, kernel_constraint=max_norm(3))) ` Here, the max_norm(3) constraint ensures that the max norm of the weights does not exceed 3. <br> ## 8. Describe the difference between _Parametric_ and _Non-Parametric_ models. Parametric and non-parametric models represent distinct approaches in statistical modeling, each with unique characteristics in terms of assumptions, computational complexity, and suitability for various types of data. ### Key Distinctions - Parametric Models: - Make explicit and often strong assumptions about data distribution. - Are defined by a fixed number of parameters, regardless of sample size. - Typically require less data for accurate estimation. - Common examples include linear regression, logistic regression, and Gaussian Naive Bayes. - Non-parametric Models: - Make minimal or no assumptions about data distribution. - The number of parameters can grow with sample size, offering more flexibility. - Generally require more data for accurate estimation. - Examples encompass k-nearest neighbors, decision trees, and random forests. ### Advantages and Disadvantages of Each Approach - Parametric Models - Advantages: - Inferential speed: Once trained, making predictions or conducting inference is often computationally fast. - Parameter interpretability: The meaning of parameters can be directly linked to the model and the data. - Efficiency with small, well-behaved datasets: Parametric models can yield highly accurate results with relatively small, clean datasets that adhere to the model's distributional assumptions. - Disadvantages: - Strong distributional assumptions: Data must closely match the specified distribution for the model to produce reliable results. - Limited flexibility: These models might not adapt well to non-standard data distributions. - Non-Parametric Models - Advantages: - Distribution-free: They do not impose strict distributional assumptions, making them more robust across a wider range of datasets. - Flexibility: Can capture complex, nonlinear relationships in the data. - Larger sample adaptability: Particularly suitable for big data or data from unknown distributions. - Disadvantages: - Computational overhead: Can be slower for making predictions, especially with large datasets. - Interpretability: Often, the predictive results are harder to interpret in terms of the original features. ### Code Example: Gaussian Naive Bayes vs. Decision Tree (Scikit-learn) Here is the Python code: `python # Gaussian Naive Bayes (parametric) from sklearn.naive_bayes import GaussianNB model = GaussianNB() # Decision Tree (non-parametric) from sklearn.tree import DecisionTreeClassifier model_dt = DecisionTreeClassifier() ` <br> ## 9. What is the _curse of dimensionality_ and how does it impact ML models? The curse of dimensionality describes the issues that arise when working with high-dimensional data, affecting the performance of machine learning models. ### Key Challenges",,hard,coding,regression|classification|probability|python|deep_learning|ensemble|feature_engineering,Devinterview-io/data-scientist-interview-questions,,2025-11-17T10:49:35.640936
"Sparse Data: As the number of dimensions increases, the data points become more spread out, and the density of data points decreases.",,medium,mixed,,Devinterview-io/data-scientist-interview-questions,,2025-11-17T10:49:35.640980
"Increased Volume of Data: With each additional dimension, the volume of the sample space grows exponentially, necessitating a larger dataset to maintain coverage.",,medium,mixed,,Devinterview-io/data-scientist-interview-questions,,2025-11-17T10:49:35.641018
Overfitting: High-dimensional spaces make it easier for models to fit to noise rather than the underlying pattern in the data.,,medium,ml,,Devinterview-io/data-scientist-interview-questions,,2025-11-17T10:49:35.641046
"Computational Complexity: Many machine learning algorithms exhibit slower performance and require more resources as the number of dimensions increases. ### Visual Example Consider a hypercube (n-dimensional cube) inscribed in a hypersphere (n-dimensional sphere) with a large number of dimensions, say 100. If you were to place a ""grid"" or uniformly spaced points within the hypercube, you'd find that the majority of these points actually fall outside the hypersphere. This disparity grows more pronounced as the number of dimensions increases, leading to a ""density gulf"" between the data contained within the hypercube and that within the hypersphere. !curse-of-dimensionality.png?alt=media&token=24d3cde6-89ae-4eb3-8d05-1d6358bb5ac9) ### Recommendations to Mitigate the Curse of Dimensionality",Google,medium,coding,,Devinterview-io/data-scientist-interview-questions,,2025-11-17T10:49:35.641133
"Feature Selection and Dimensionality Reduction: Prioritize quality over quantity of features. Techniques like PCA, t-SNE, and LDA can help reduce dimensions.",,medium,coding,feature_engineering,Devinterview-io/data-scientist-interview-questions,,2025-11-17T10:49:35.641161
"Simpler Models: Consider using algorithms with less sensitivity to high dimensions, even if it means sacrificing a bit of performance.",,medium,coding,,Devinterview-io/data-scientist-interview-questions,,2025-11-17T10:49:35.641187
"Sparse Models: For high-dimensional, sparse datasets, models that can handle sparsity, like LASSO or ElasticNet, might be beneficial.",,medium,ml,,Devinterview-io/data-scientist-interview-questions,,2025-11-17T10:49:35.641215
Feature Engineering: Craft domain-specific features that can capture relevant information more efficiently.,,medium,mixed,feature_engineering,Devinterview-io/data-scientist-interview-questions,,2025-11-17T10:49:35.641243
"Data Quality: Strive for a high-quality dataset, as more data doesn't necessarily counteract the curse of dimensionality.",,medium,mixed,,Devinterview-io/data-scientist-interview-questions,,2025-11-17T10:49:35.641273
"Data Stratification and Sampling: When possible, stratify and sample data to ensure coverage across the high-dimensional space.",,medium,mixed,,Devinterview-io/data-scientist-interview-questions,,2025-11-17T10:49:35.641303
"Computational Resources: Leverage cloud computing or powerful hardware to handle the increased computational demands. <br> ## 10. Explain the concept of _Feature Engineering_ and its significance in ML. Feature engineering is a vital component of the machine-learning pipeline. It entails creating meaningful and robust representations of the data upon which the model will be built. ### Significance of Feature Engineering - Improved Model Performance: High-quality features can make even simple models more effective, while poor features can hamper the performance of the most advanced models. - Dimensionality Reduction: Carefully engineered features can distill relevant information from high-dimensional data, leading to more efficient and accurate models. - Model Interpretability: Certain feature engineering techniques, such as binning or one-hot encoding, make it easier to understand and interpret the model's decisions. - Computational Efficiency: Engineered features can often streamline computational processes, making predictions faster and cheaper. ### Common Feature Engineering Techniques",,hard,stats,hypothesis_testing|metrics|feature_engineering,Devinterview-io/data-scientist-interview-questions,,2025-11-17T10:49:35.641434
"Handling Missing Data - Removing or imputing missing values. - Creating a separate ""missing"" category.",,medium,mixed,,Devinterview-io/data-scientist-interview-questions,,2025-11-17T10:49:35.641465
"Handling Categorical Data - Converting categories into ordinal values. - Using one-hot encoding to create binary ""dummy"" variables. - Grouping rare categories into an ""other"" category.",,medium,mixed,,Devinterview-io/data-scientist-interview-questions,,2025-11-17T10:49:35.641504
"Handling Temporal Data - Extracting specific time-related features from timestamps, such as hour or month. - Converting timestamps into different representations, like age or duration since a specific event.",,medium,mixed,feature_engineering,Devinterview-io/data-scientist-interview-questions,,2025-11-17T10:49:35.641544
Variable Transformation - Using mathematical transformations such as logarithms. - Normalizing or scaling data to a specific range.,,medium,mixed,,Devinterview-io/data-scientist-interview-questions,,2025-11-17T10:49:35.641576
"Discretization - Converting continuous variables into discrete bins, e.g., converting age to age groups.",,medium,mixed,,Devinterview-io/data-scientist-interview-questions,,2025-11-17T10:49:35.641609
Feature Extraction - Reducing dimensionality through techniques like PCA or LDA.,,medium,mixed,feature_engineering,Devinterview-io/data-scientist-interview-questions,,2025-11-17T10:49:35.641634
"Feature Creation - Engineering domain-specific metrics. - Generating polynomial or interaction features. <br> ## 11. What is _Data Preprocessing_ and why is it important in ML? Data Preprocessing is a vital early-stage task in any machine learning project. It involves cleaning, transforming, and standardizing data to make it more suitable for predictive modeling. ### Key Steps in Data Preprocessing",,medium,ml,metrics|feature_engineering,Devinterview-io/data-scientist-interview-questions,,2025-11-17T10:49:35.641691
Data Cleaning: - Address missing values: Implement strategies like imputation or removal. - Outlier detection and handling: Identify and deal with data points that deviate significantly from the rest.,,medium,mixed,,Devinterview-io/data-scientist-interview-questions,,2025-11-17T10:49:35.641732
Feature Selection and Engineering: - Choose the most relevant features that contribute to the model's predictive accuracy. - Create new features that might improve the model's performance.,,medium,coding,feature_engineering,Devinterview-io/data-scientist-interview-questions,,2025-11-17T10:49:35.641762
"Data Transformation: - Normalize or standardize numerical data to ensure all features contribute equally. - Convert categorical data into a format understandable by the model, often using techniques like one-hot encoding. - Discretize continuous data when required.",,medium,ml,feature_engineering,Devinterview-io/data-scientist-interview-questions,,2025-11-17T10:49:35.641805
"Data Integration: - Combine data from multiple sources, ensuring compatibility and consistency.",,medium,mixed,,Devinterview-io/data-scientist-interview-questions,,2025-11-17T10:49:35.641847
